{
  "dir": "ltr",
  "lang": "en-US",
  "name": "Color Picker",
  "name_localized": {
    "ar": { "dir": "rtl", "value": "منتقي الألوان" },
    "de": "Farbwähler",
    "en": { "value": "Color Picker" },
    "en-GB": { "dir": "ltr", "value": "Colour Picker" },
    "fr": { "dir": "ltr", "lang": "fr-CA", "value": "Sélecteur de Couleur" }
  }
}
