{
  "dir": "ltr",
  "icons": [
    {
      "sizes": "64x64",
      "src": "icons/en.png"
    }
  ],
  "icons_localized": {
    "fr": [
      {
        "sizes": "64x64",
        "src": "icons/fr.png"
      }
    ]
  },
  "lang": "en-US",
  "name": "Color Picker",
  "name_localized": {
    "de": "Farbwaehler",
    "en-GB": {
      "dir": "ltr",
      "value": "Colour Picker"
    },
    "fr": {
      "lang": "fr-CA",
      "value": "Selecteur de Couleur"
    }
  },
  "short_name": "Picker",
  "short_name_localized": {
    "de": {
      "lang": "de",
      "value": "Picker"
    }
  },
  "shortcuts": [
    {
      "description": "Open a saved color palette.",
      "description_localized": {
        "fr": "Ouvrir une palette de couleurs."
      },
      "icons": [
        {
          "sizes": "48x48",
          "src": "icons/palette.png"
        }
      ],
      "icons_localized": {
        "fr": [
          {
            "sizes": "48x48",
            "src": "icons/palette-fr.png"
          }
        ]
      },
      "name": "Open palette",
      "name_localized": {
        "fr": "Ouvrir la palette"
      },
      "short_name": "Palette",
      "short_name_localized": {
        "fr": {
          "value": "Palette"
        }
      },
      "url": "/palette"
    }
  ]
}
